{
  "results_format_version": "2.0.0",
  "generated": "2026-09-14T22:24:02.934004+02:00",
  "source_runs": [
    "2026-09-14_thor_7b-fp16-edgellm-thor-v2_p1-context_bs1_r01"
  ],
  "rows": [
    {
      "config_id": "7b-fp16-edgellm-thor-v2",
      "run_id": "2026-09-14_thor_7b-fp16-edgellm-thor-v2_p1-context_bs1_r01",
      "framework": "edge-llm",
      "representation": {
        "declared_label": "fp16 (TensorRT Edge-LLM engine, unquantized)",
        "backend": "edge-llm",
        "weights": {
          "dtype": "bf16",
          "method": "none (unquantized)",
          "granularity": "n/a (unquantized)",
          "group_size": null,
          "symmetric": null,
          "storage_dtype_histogram_params": {
            "BF16": 7615616512
          },
          "_granularity_source": "safetensors tensor table - no quantization_config present, so this checkpoint declares no quantizer and the storage dtype IS the scheme"
        },
        "activations": {
          "dtype": "bfloat16",
          "_source": "checkpoint torch_dtype; the runtime was not asked to override it"
        },
        "kv_cache": {
          "dtype": "auto -> model dtype",
          "_source": "launch configuration (vLLM --kv-cache-dtype; 'auto' means the model dtype)"
        },
        "modules_kept_fp": [
          "biases",
          "embeddings",
          "lm_head",
          "norms"
        ],
        "modules_quantized": [],
        "module_storage_types": {
          "lm_head": [
            "BF16"
          ],
          "embeddings": [
            "BF16"
          ],
          "norms": [
            "BF16"
          ],
          "biases": [
            "BF16"
          ]
        },
        "calibration": {
          "dataset": null,
          "n_samples": null,
          "matches_deployment_domain": null,
          "_not_collected": "no calibration step in this config's provenance (unquantized, or a vendor checkpoint whose calibration set the publisher did not state)"
        },
        "artifact_bytes": 15231271888,
        "param_count": 7615616512,
        "param_count_method": "summed from the safetensors tensor table",
        "effective_bits_per_weight": 16.0,
        "comparability_class": "fp16_baseline"
      },
      "condition": {
        "prompt_tokens_target": 128,
        "prompt_tokens_achieved_p50": 157.0,
        "gen_tokens_requested": 128,
        "gen_tokens_achieved_p50": 128.0,
        "concurrency": 1,
        "nvpmodel": "120W",
        "execution_condition": "standalone",
        "prompt_sha256": "72f32628eb55c217c49466429c3e4bb9e82f790fc5145f0ae678338055d4a4ab"
      },
      "latency": {
        "n_requests": 30,
        "n_ok": 30,
        "ttft_ms_p50": {
          "value": 80.30466450145468,
          "unit": "ms",
          "ci95": [
            79.60370802902617,
            81.11151299090125
          ],
          "n": 30,
          "method": "bootstrap"
        },
        "ttft_ms_p90": {
          "value": 85.12460407218896,
          "unit": "ms",
          "ci95": [
            81.30724970833398,
            90.51803566399036
          ],
          "n": 30,
          "method": "bootstrap"
        },
        "ttft_ms_p99": {
          "value": 119.27567867969633,
          "unit": "ms",
          "ci95": [
            84.18911710847169,
            132.94734503142536
          ],
          "n": 30,
          "method": "bootstrap"
        },
        "turn_ms_p50": {
          "value": 7738.2759650063235,
          "unit": "ms",
          "ci95": [
            7712.814028462162,
            7948.543960461393
          ],
          "n": 30,
          "method": "bootstrap"
        },
        "turn_ms_p90": {
          "value": 8277.025865291944,
          "unit": "ms",
          "ci95": [
            8050.6619813037105,
            8298.14713911037
          ],
          "n": 30,
          "method": "bootstrap"
        },
        "turn_ms_p99": {
          "value": 8304.600677391863,
          "unit": "ms",
          "ci95": [
            8264.722508730483,
            8307.668752968311
          ],
          "n": 30,
          "method": "bootstrap"
        },
        "decode_ms_p50": {
          "value": 7645.515209966106,
          "unit": "ms",
          "ci95": [
            7631.881745997816,
            7865.2705299900845
          ],
          "n": 30,
          "method": "bootstrap"
        },
        "decode_ms_p90": {
          "value": 8192.51436581253,
          "unit": "ms",
          "ci95": [
            7968.789351405577,
            8216.534182877513
          ],
          "n": 30,
          "method": "bootstrap"
        },
        "decode_ms_p99": {
          "value": 8220.2071325836,
          "unit": "ms",
          "ci95": [
            8180.75835968717,
            8221.953289001249
          ],
          "n": 30,
          "method": "bootstrap"
        },
        "inter_token_ms_p50": {
          "value": 60.354912478942424,
          "unit": "ms",
          "ci95": [
            60.30098148039542,
            60.4086107283365
          ],
          "n": 3810,
          "method": "bootstrap"
        },
        "inter_token_ms_p90": {
          "value": 64.6190533763729,
          "unit": "ms",
          "ci95": [
            64.41417370224372,
            64.80050104437396
          ],
          "n": 3810,
          "method": "bootstrap"
        },
        "inter_token_ms_p99": {
          "value": 69.96419962553772,
          "unit": "ms",
          "ci95": [
            68.94696498056874,
            70.90178543527142
          ],
          "n": 3810,
          "method": "bootstrap"
        },
        "inter_token_ms_stdev": {
          "value": 2.677760887484818,
          "unit": "ms",
          "ci95": [
            2.5684731123628555,
            2.7827525883237603
          ],
          "n": 3810,
          "method": "bootstrap"
        },
        "inter_token_ms_n_gaps": 3810,
        "inter_token_ms_ecdf": {
          "q": [
            0,
            1,
            2,
            3,
            4,
            5,
            6,
            7,
            8,
            9,
            10,
            11,
            12,
            13,
            14,
            15,
            16,
            17,
            18,
            19,
            20,
            21,
            22,
            23,
            24,
            25,
            26,
            27,
            28,
            29,
            30,
            31,
            32,
            33,
            34,
            35,
            36,
            37,
            38,
            39,
            40,
            41,
            42,
            43,
            44,
            45,
            46,
            47,
            48,
            49,
            50,
            51,
            52,
            53,
            54,
            55,
            56,
            57,
            58,
            59,
            60,
            61,
            62,
            63,
            64,
            65,
            66,
            67,
            68,
            69,
            70,
            71,
            72,
            73,
            74,
            75,
            76,
            77,
            78,
            79,
            80,
            81,
            82,
            83,
            84,
            85,
            86,
            87,
            88,
            89,
            90,
            91,
            92,
            93,
            94,
            95,
            96,
            97,
            98,
            99,
            100
          ],
          "ms": [
            49.9961,
            57.1914,
            58.1908,
            58.3927,
            58.501,
            58.6154,
            58.6947,
            58.7703,
            58.8201,
            58.8689,
            58.9182,
            58.9701,
            59.0198,
            59.071,
            59.1337,
            59.1718,
            59.2143,
            59.265,
            59.3022,
            59.3405,
            59.3851,
            59.4306,
            59.4603,
            59.4944,
            59.5352,
            59.5679,
            59.6106,
            59.6468,
            59.6828,
            59.7204,
            59.7479,
            59.7787,
            59.8113,
            59.8379,
            59.8666,
            59.8942,
            59.9215,
            59.9521,
            59.9792,
            60.012,
            60.0409,
            60.0689,
            60.0962,
            60.1185,
            60.1497,
            60.1846,
            60.2116,
            60.2549,
            60.2819,
            60.3204,
            60.3549,
            60.3945,
            60.422,
            60.4589,
            60.4955,
            60.5448,
            60.5839,
            60.6347,
            60.6843,
            60.7403,
            60.7888,
            60.8423,
            60.928,
            61.002,
            61.1077,
            61.221,
            61.399,
            61.6517,
            61.9608,
            62.2212,
            62.4273,
            62.5765,
            62.7143,
            62.8647,
            62.9722,
            63.0651,
            63.142,
            63.2338,
            63.3296,
            63.4169,
            63.5105,
            63.5947,
            63.6662,
            63.7461,
            63.8401,
            63.9032,
            63.9965,
            64.0961,
            64.2556,
            64.4129,
            64.6191,
            64.8106,
            65.0837,
            65.4297,
            65.8679,
            66.3776,
            66.9644,
            67.5408,
            68.1413,
            69.9642,
            79.8009
          ],
          "n": 3810
        },